{
  "case_id": "X2_MEMBER_c9b9c8f30cf5853e30f68f06",
  "directed_links": [
    {
      "destination_node_id": 3,
      "link_id": 0,
      "source_node_id": 0
    },
    {
      "destination_node_id": 0,
      "link_id": 1,
      "source_node_id": 3
    },
    {
      "destination_node_id": 10,
      "link_id": 2,
      "source_node_id": 0
    },
    {
      "destination_node_id": 0,
      "link_id": 3,
      "source_node_id": 10
    },
    {
      "destination_node_id": 23,
      "link_id": 4,
      "source_node_id": 0
    },
    {
      "destination_node_id": 0,
      "link_id": 5,
      "source_node_id": 23
    },
    {
      "destination_node_id": 3,
      "link_id": 6,
      "source_node_id": 1
    },
    {
      "destination_node_id": 1,
      "link_id": 7,
      "source_node_id": 3
    },
    {
      "destination_node_id": 44,
      "link_id": 8,
      "source_node_id": 1
    },
    {
      "destination_node_id": 1,
      "link_id": 9,
      "source_node_id": 44
    },
    {
      "destination_node_id": 3,
      "link_id": 10,
      "source_node_id": 2
    },
    {
      "destination_node_id": 2,
      "link_id": 11,
      "source_node_id": 3
    },
    {
      "destination_node_id": 23,
      "link_id": 12,
      "source_node_id": 2
    },
    {
      "destination_node_id": 2,
      "link_id": 13,
      "source_node_id": 23
    },
    {
      "destination_node_id": 43,
      "link_id": 14,
      "source_node_id": 2
    },
    {
      "destination_node_id": 2,
      "link_id": 15,
      "source_node_id": 43
    },
    {
      "destination_node_id": 44,
      "link_id": 16,
      "source_node_id": 2
    },
    {
      "destination_node_id": 2,
      "link_id": 17,
      "source_node_id": 44
    },
    {
      "destination_node_id": 5,
      "link_id": 18,
      "source_node_id": 4
    },
    {
      "destination_node_id": 4,
      "link_id": 19,
      "source_node_id": 5
    },
    {
      "destination_node_id": 7,
      "link_id": 20,
      "source_node_id": 4
    },
    {
      "destination_node_id": 4,
      "link_id": 21,
      "source_node_id": 7
    },
    {
      "destination_node_id": 9,
      "link_id": 22,
      "source_node_id": 4
    },
    {
      "destination_node_id": 4,
      "link_id": 23,
      "source_node_id": 9
    },
    {
      "destination_node_id": 6,
      "link_id": 24,
      "source_node_id": 5
    },
    {
      "destination_node_id": 5,
      "link_id": 25,
      "source_node_id": 6
    },
    {
      "destination_node_id": 29,
      "link_id": 26,
      "source_node_id": 5
    },
    {
      "destination_node_id": 5,
      "link_id": 27,
      "source_node_id": 29
    },
    {
      "destination_node_id": 11,
      "link_id": 28,
      "source_node_id": 6
    },
    {
      "destination_node_id": 6,
      "link_id": 29,
      "source_node_id": 11
    },
    {
      "destination_node_id": 29,
      "link_id": 30,
      "source_node_id": 6
    },
    {
      "destination_node_id": 6,
      "link_id": 31,
      "source_node_id": 29
    },
    {
      "destination_node_id": 46,
      "link_id": 32,
      "source_node_id": 6
    },
    {
      "destination_node_id": 6,
      "link_id": 33,
      "source_node_id": 46
    },
    {
      "destination_node_id": 52,
      "link_id": 34,
      "source_node_id": 6
    },
    {
      "destination_node_id": 6,
      "link_id": 35,
      "source_node_id": 52
    },
    {
      "destination_node_id": 8,
      "link_id": 36,
      "source_node_id": 7
    },
    {
      "destination_node_id": 7,
      "link_id": 37,
      "source_node_id": 8
    },
    {
      "destination_node_id": 9,
      "link_id": 38,
      "source_node_id": 8
    },
    {
      "destination_node_id": 8,
      "link_id": 39,
      "source_node_id": 9
    },
    {
      "destination_node_id": 35,
      "link_id": 40,
      "source_node_id": 8
    },
    {
      "destination_node_id": 8,
      "link_id": 41,
      "source_node_id": 35
    },
    {
      "destination_node_id": 11,
      "link_id": 42,
      "source_node_id": 9
    },
    {
      "destination_node_id": 9,
      "link_id": 43,
      "source_node_id": 11
    },
    {
      "destination_node_id": 36,
      "link_id": 44,
      "source_node_id": 9
    },
    {
      "destination_node_id": 9,
      "link_id": 45,
      "source_node_id": 36
    },
    {
      "destination_node_id": 24,
      "link_id": 46,
      "source_node_id": 10
    },
    {
      "destination_node_id": 10,
      "link_id": 47,
      "source_node_id": 24
    },
    {
      "destination_node_id": 27,
      "link_id": 48,
      "source_node_id": 11
    },
    {
      "destination_node_id": 11,
      "link_id": 49,
      "source_node_id": 27
    },
    {
      "destination_node_id": 32,
      "link_id": 50,
      "source_node_id": 11
    },
    {
      "destination_node_id": 11,
      "link_id": 51,
      "source_node_id": 32
    },
    {
      "destination_node_id": 36,
      "link_id": 52,
      "source_node_id": 11
    },
    {
      "destination_node_id": 11,
      "link_id": 53,
      "source_node_id": 36
    },
    {
      "destination_node_id": 37,
      "link_id": 54,
      "source_node_id": 11
    },
    {
      "destination_node_id": 11,
      "link_id": 55,
      "source_node_id": 37
    },
    {
      "destination_node_id": 48,
      "link_id": 56,
      "source_node_id": 11
    },
    {
      "destination_node_id": 11,
      "link_id": 57,
      "source_node_id": 48
    },
    {
      "destination_node_id": 13,
      "link_id": 58,
      "source_node_id": 12
    },
    {
      "destination_node_id": 12,
      "link_id": 59,
      "source_node_id": 13
    },
    {
      "destination_node_id": 21,
      "link_id": 60,
      "source_node_id": 12
    },
    {
      "destination_node_id": 12,
      "link_id": 61,
      "source_node_id": 21
    },
    {
      "destination_node_id": 26,
      "link_id": 62,
      "source_node_id": 13
    },
    {
      "destination_node_id": 13,
      "link_id": 63,
      "source_node_id": 26
    },
    {
      "destination_node_id": 15,
      "link_id": 64,
      "source_node_id": 14
    },
    {
      "destination_node_id": 14,
      "link_id": 65,
      "source_node_id": 15
    },
    {
      "destination_node_id": 22,
      "link_id": 66,
      "source_node_id": 14
    },
    {
      "destination_node_id": 14,
      "link_id": 67,
      "source_node_id": 22
    },
    {
      "destination_node_id": 33,
      "link_id": 68,
      "source_node_id": 14
    },
    {
      "destination_node_id": 14,
      "link_id": 69,
      "source_node_id": 33
    },
    {
      "destination_node_id": 16,
      "link_id": 70,
      "source_node_id": 15
    },
    {
      "destination_node_id": 15,
      "link_id": 71,
      "source_node_id": 16
    },
    {
      "destination_node_id": 17,
      "link_id": 72,
      "source_node_id": 16
    },
    {
      "destination_node_id": 16,
      "link_id": 73,
      "source_node_id": 17
    },
    {
      "destination_node_id": 18,
      "link_id": 74,
      "source_node_id": 16
    },
    {
      "destination_node_id": 16,
      "link_id": 75,
      "source_node_id": 18
    },
    {
      "destination_node_id": 18,
      "link_id": 76,
      "source_node_id": 17
    },
    {
      "destination_node_id": 17,
      "link_id": 77,
      "source_node_id": 18
    },
    {
      "destination_node_id": 19,
      "link_id": 78,
      "source_node_id": 18
    },
    {
      "destination_node_id": 18,
      "link_id": 79,
      "source_node_id": 19
    },
    {
      "destination_node_id": 20,
      "link_id": 80,
      "source_node_id": 19
    },
    {
      "destination_node_id": 19,
      "link_id": 81,
      "source_node_id": 20
    },
    {
      "destination_node_id": 21,
      "link_id": 82,
      "source_node_id": 19
    },
    {
      "destination_node_id": 19,
      "link_id": 83,
      "source_node_id": 21
    },
    {
      "destination_node_id": 28,
      "link_id": 84,
      "source_node_id": 20
    },
    {
      "destination_node_id": 20,
      "link_id": 85,
      "source_node_id": 28
    },
    {
      "destination_node_id": 34,
      "link_id": 86,
      "source_node_id": 22
    },
    {
      "destination_node_id": 22,
      "link_id": 87,
      "source_node_id": 34
    },
    {
      "destination_node_id": 39,
      "link_id": 88,
      "source_node_id": 22
    },
    {
      "destination_node_id": 22,
      "link_id": 89,
      "source_node_id": 39
    },
    {
      "destination_node_id": 24,
      "link_id": 90,
      "source_node_id": 23
    },
    {
      "destination_node_id": 23,
      "link_id": 91,
      "source_node_id": 24
    },
    {
      "destination_node_id": 29,
      "link_id": 92,
      "source_node_id": 23
    },
    {
      "destination_node_id": 23,
      "link_id": 93,
      "source_node_id": 29
    },
    {
      "destination_node_id": 31,
      "link_id": 94,
      "source_node_id": 23
    },
    {
      "destination_node_id": 23,
      "link_id": 95,
      "source_node_id": 31
    },
    {
      "destination_node_id": 31,
      "link_id": 96,
      "source_node_id": 24
    },
    {
      "destination_node_id": 24,
      "link_id": 97,
      "source_node_id": 31
    },
    {
      "destination_node_id": 26,
      "link_id": 98,
      "source_node_id": 25
    },
    {
      "destination_node_id": 25,
      "link_id": 99,
      "source_node_id": 26
    },
    {
      "destination_node_id": 28,
      "link_id": 100,
      "source_node_id": 25
    },
    {
      "destination_node_id": 25,
      "link_id": 101,
      "source_node_id": 28
    },
    {
      "destination_node_id": 30,
      "link_id": 102,
      "source_node_id": 27
    },
    {
      "destination_node_id": 27,
      "link_id": 103,
      "source_node_id": 30
    },
    {
      "destination_node_id": 32,
      "link_id": 104,
      "source_node_id": 27
    },
    {
      "destination_node_id": 27,
      "link_id": 105,
      "source_node_id": 32
    },
    {